<?xml version="1.0" encoding="UTF-8"?>

<root
    xmlns:xsi='http://www.w3.org/2001/XMLSchema-instance'
    xmlns='http://editor.huliqing.name'
    xsi:schemaLocation='http://editor.huliqing.name meta.xsd'>
    
    <!--DataConverters-->
    <converter name="SimpleDataConverter" value="name.huliqing.editor.converter.data.SimpleDataConverter" />
    
    <!--FieldConverters-->
    <converter name="CheckBoxConverter" value="name.huliqing.editor.converter.field.CheckBoxConverter" />
    <converter name="ChoiceConverter" value="name.huliqing.editor.converter.field.ChoiceConverter" />
    <converter name="ColorConverter" value="name.huliqing.editor.converter.field.ColorConverter" />
    <converter name="DataFieldConverter" value="name.huliqing.editor.converter.field.DataFieldConverter" />
    <converter name="FileConverter" value="name.huliqing.editor.converter.field.FileConverter" />
    <converter name="QuaternionConverter" value="name.huliqing.editor.converter.field.QuaternionConverter" />
    <converter name="TextConverter" value="name.huliqing.editor.converter.field.TextConverter" />
    <converter name="Vector2fConverter" value="name.huliqing.editor.converter.field.Vector2fConverter" />
    <converter name="Vector3fConverter" value="name.huliqing.editor.converter.field.Vector3fConverter" />
    <converter name="Vector4fConverter" value="name.huliqing.editor.converter.field.Vector4fConverter" />
    
    <data name="base" extends="" converter="SimpleDataConverter">
        <field name="id" converter="TextConverter">
            <feature name="disabled" value="true" />
            <feature name="collapsed" value="true" />
        </field>
        <field name="extends" converter="TextConverter">
            <feature name="disabled" value="true" />
            <feature name="collapsed" value="true" />
        </field>
    </data>

    <data name="sound" extends="base" >
        <field name="file" converter="FileConverter" />
        <field name="type" converter="ChoiceConverter" >
            <feature name="items" value="Buffer,Stream" />
        </field>
        <field name="direction" converter="Vector3fConverter" />
        <field name="directional" converter="CheckBoxConverter" />
        <field name="positional" converter="CheckBoxConverter" />
        <field name="innerAngle" converter="TextConverter" />
        <field name="outerAngle" converter="TextConverter" />
        <field name="looping" converter="CheckBoxConverter" />
        <field name="maxDistance" converter="TextConverter" />
        <field name="pitch" converter="TextConverter" />
        <field name="refDistance" converter="TextConverter" />
        <field name="reverbEnabled" converter="CheckBoxConverter" />
        <field name="timeOffset" converter="TextConverter" />
        <field name="velocity" converter="Vector3fConverter" />
        <field name="velocityFromTranslation" converter="CheckBoxConverter" />
        <field name="volume" converter="TextConverter" />
    </data>
    
</root>
